Enter password: ***********
Welcome to the MySQL monitor.  Commands end with ; or \g.
Your MySQL connection id is 30
Server version: 8.0.41 MySQL Community Server - GPL

Copyright (c) 2000, 2025, Oracle and/or its affiliates.

Oracle is a registered trademark of Oracle Corporation and/or its
affiliates. Other names may be trademarks of their respective
owners.

Type 'help;' or '\h' for help. Type '\c' to clear the current input statement.

mysql> CREATE TABLE CUSTOMERS(
    -> ID INT NOT NULL,
    -> NAME VARCHAR (20) NOT NULL,
    -> AGE INT NOT NULL,
    -> ADDRESS CHAR (25) ,
    -> SALARY DECIMAL (18, 2),
    -> PRIMARY KEY (ID)
    -> );
ERROR 1046 (3D000): No database selected
mysql> use nit;
Database changed
mysql> CREATE TABLE CUSTOMERS(
    -> ID INT NOT NULL,
    -> NAME VARCHAR (20) NOT NULL,
    -> AGE INT NOT NULL,
    -> ADDRESS CHAR (25) ,
    -> SALARY DECIMAL (18, 2),
    -> PRIMARY KEY (ID)
    -> );
Query OK, 0 rows affected (0.03 sec)

mysql> ALTER TABLE CUSTOMERS
    -> MODIFY SALARY DECIMAL (18, 2) NOT NULL;
Query OK, 0 rows affected (0.05 sec)
Records: 0  Duplicates: 0  Warnings: 0

mysql> CREATE TABLE CUSTOMERS(
    -> ID INT NOT NULL,
    -> NAME VARCHAR (20) NOT NULL,
    -> AGE INT NOT NULL,
    -> ADDRESS CHAR (25) ,
    -> SALARY DECIMAL (18, 2) DEFAULT 5000.00,
    -> PRIMARY KEY (ID)
    -> );
ERROR 1050 (42S01): Table 'customers' already exists
mysql> ALTER TABLE CUSTOMERS
    -> MODIFY AGE INT NOT NULL UNIQUE;
Query OK, 0 rows affected (0.03 sec)
Records: 0  Duplicates: 0  Warnings: 0

mysql> ALTER TABLE CUSTOMERS
    -> ADD CONSTRAINT myUniqueConstraint UNIQUE(AGE, SALARY);
Query OK, 0 rows affected (0.02 sec)
Records: 0  Duplicates: 0  Warnings: 0

mysql> ALTER TABLE CUSTOMERS
    -> DROP CONSTRAINT myUniqueConstraint;
Query OK, 0 rows affected (0.02 sec)
Records: 0  Duplicates: 0  Warnings: 0

mysql> ALTER TABLE CUSTOMERS
    -> DROP INDEX myUniqueConstraint;
ERROR 1091 (42000): Can't DROP 'myUniqueConstraint'; check that column/key exists
mysql> ALTER TABLE CUSTOMERS
    -> DROP CONSTRAINT myUniqueConstraint;
ERROR 3940 (HY000): Constraint 'myUniqueConstraint' does not exist.
mysql> CREATE TABLE CUSTOMERS(
    -> ID INT NOT NULL,
    -> NAME VARCHAR (20) NOT NULL,
    -> AGE INT NOT NULL,
    -> ADDRESS CHAR (25) ,
    -> SALARY DECIMAL (18, 2),
    -> PRIMARY KEY (ID)
    -> );
ERROR 1050 (42S01): Table 'customers' already exists
mysql> ALTER TABLE CUSTOMERS DROP PRIMARY KEY ;
Query OK, 0 rows affected (0.07 sec)
Records: 0  Duplicates: 0  Warnings: 0

mysql> CREATE TABLE CUSTOMERS(
    -> ID INT NOT NULL,
    -> NAME VARCHAR (20) NOT NULL,
    -> AGE INT NOT NULL,
    -> ADDRESS CHAR (25) ,
    -> SALARY DECIMAL (18, 2),
    -> PRIMARY KEY (ID)
    -> );
ERROR 1050 (42S01): Table 'customers' already exists
mysql> CREATE TABLE ORDERS (
    -> ID INT NOT NULL,
    -> DATE DATETIME,
    -> CUSTOMER_ID INT references CUSTOMERS(ID),
    -> AMOUNT double,
    -> PRIMARY KEY (ID)
    -> );
Query OK, 0 rows affected (0.03 sec)

mysql> drop table customers
    -> ;
Query OK, 0 rows affected (0.03 sec)

mysql> CREATE TABLE CUSTOMERS(
    -> ID INT NOT NULL,
    -> NAME VARCHAR (20) NOT NULL,
    -> AGE INT NOT NULL,
    -> ADDRESS CHAR (25) ,
    -> SALARY DECIMAL (18, 2),
    -> PRIMARY KEY (ID)
    -> );
Query OK, 0 rows affected (0.04 sec)

mysql> ALTER TABLE ORDERS
    -> ADD FOREIGN KEY (Customer_ID) REFERENCES CUSTOMERS (ID);
Query OK, 0 rows affected (0.07 sec)
Records: 0  Duplicates: 0  Warnings: 0

mysql> ALTER TABLE ORDERS
    -> DROP FOREIGN KEY;
ERROR 1064 (42000): You have an error in your SQL syntax; check the manual that corresponds to your MySQL server version for the right syntax to use near '' at line 2
mysql> ALTER TABLE ORDERS DROP FOREIGN KEY;
ERROR 1064 (42000): You have an error in your SQL syntax; check the manual that corresponds to your MySQL server version for the right syntax to use near '' at line 1
mysql> CREATE TABLE CUSTOMERS(
    -> ID INT NOT NULL,
    -> NAME VARCHAR (20) NOT NULL,
    -> AGE INT NOT NULL CHECK (AGE >= 18),
    -> ADDRESS CHAR (25) ,
    -> SALARY DECIMAL (18, 2),
    -> PRIMARY KEY (ID)
    -> );
ERROR 1050 (42S01): Table 'customers' already exists
mysql> ALTER TABLE CUSTOMERS
    -> MODIFY AGE INT NOT NULL CHECK (AGE >= 18 );
Query OK, 0 rows affected (0.08 sec)
Records: 0  Duplicates: 0  Warnings: 0

mysql> ALTER TABLE CUSTOMERS
    -> ADD CONSTRAINT myCheckConstraint CHECK(AGE >= 18);
Query OK, 0 rows affected (0.07 sec)
Records: 0  Duplicates: 0  Warnings: 0

mysql> ALTER TABLE CUSTOMERS
    -> DROP CONSTRAINT myCheckConstraint;
Query OK, 0 rows affected (0.02 sec)
Records: 0  Duplicates: 0  Warnings: 0

mysql> SELECT * FROM CUSTOMERS WHERE SALARY = 2000;
+----+---------+-----+-----------+---------+
| ID | NAME    | AGE | ADDRESS   | SALARY  |
+----+---------+-----+-----------+---------+
|  1 | Ramesh  |  32 | Ahmedabad | 2000.00 |
|  3 | kaushik |  23 | Kota      | 2000.00 |
+----+---------+-----+-----------+---------+
2 rows in set (0.00 sec)

mysql> SELECT * FROM CUSTOMERS WHERE SALARY != 2000;
+----+----------+-----+-----------+----------+
| ID | NAME     | AGE | ADDRESS   | SALARY   |
+----+----------+-----+-----------+----------+
|  2 | Khilan   |  25 | Delhi     |  1500.00 |
|  4 | Chaitali |  25 | mumbai    |  6500.00 |
|  5 | Hardik   |  27 | Bhopal    |  8500.00 |
|  6 | Komal    |  22 | Hyderabad |  4000.00 |
|  7 | Muffy    |  24 | Indore    | 10000.00 |
+----+----------+-----+-----------+----------+
5 rows in set (0.00 sec)

mysql> SELECT * FROM CUSTOMERS WHERE SALARY <> 2000;
+----+----------+-----+-----------+----------+
| ID | NAME     | AGE | ADDRESS   | SALARY   |
+----+----------+-----+-----------+----------+
|  2 | Khilan   |  25 | Delhi     |  1500.00 |
|  4 | Chaitali |  25 | mumbai    |  6500.00 |
|  5 | Hardik   |  27 | Bhopal    |  8500.00 |
|  6 | Komal    |  22 | Hyderabad |  4000.00 |
|  7 | Muffy    |  24 | Indore    | 10000.00 |
+----+----------+-----+-----------+----------+
5 rows in set (0.00 sec)

mysql> SELECT * FROM CUSTOMERS WHERE SALARY >= 6500;
+----+----------+-----+---------+----------+
| ID | NAME     | AGE | ADDRESS | SALARY   |
+----+----------+-----+---------+----------+
|  4 | Chaitali |  25 | mumbai  |  6500.00 |
|  5 | Hardik   |  27 | Bhopal  |  8500.00 |
|  7 | Muffy    |  24 | Indore  | 10000.00 |
+----+----------+-----+---------+----------+
3 rows in set (0.00 sec)

mysql> SELECT * FROM CUSTOMERS WHERE SALARY >= 6500;
+----+----------+-----+---------+----------+
| ID | NAME     | AGE | ADDRESS | SALARY   |
+----+----------+-----+---------+----------+
|  4 | Chaitali |  25 | mumbai  |  6500.00 |
|  5 | Hardik   |  27 | Bhopal  |  8500.00 |
|  7 | Muffy    |  24 | Indore  | 10000.00 |
+----+----------+-----+---------+----------+
3 rows in set (0.00 sec)

mysql> SELECT * FROM CUSTOMERS;
+----+----------+-----+-----------+----------+
| ID | NAME     | AGE | ADDRESS   | SALARY   |
+----+----------+-----+-----------+----------+
|  1 | Ramesh   |  32 | Ahmedabad |  2000.00 |
|  2 | Khilan   |  25 | Delhi     |  1500.00 |
|  3 | kaushik  |  23 | Kota      |  2000.00 |
|  4 | Chaitali |  25 | mumbai    |  6500.00 |
|  5 | Hardik   |  27 | Bhopal    |  8500.00 |
|  6 | Komal    |  22 | Hyderabad |  4000.00 |
|  7 | Muffy    |  24 | Indore    | 10000.00 |
+----+----------+-----+-----------+----------+
7 rows in set (0.00 sec)

mysql> SELECT * FROM CUSTOMERS WHERE AGE >= 25 AND SALARY >= 6500;
+----+----------+-----+---------+---------+
| ID | NAME     | AGE | ADDRESS | SALARY  |
+----+----------+-----+---------+---------+
|  4 | Chaitali |  25 | mumbai  | 6500.00 |
|  5 | Hardik   |  27 | Bhopal  | 8500.00 |
+----+----------+-----+---------+---------+
2 rows in set (0.00 sec)

mysql> SELECT * FROM CUSTOMERS WHERE AGE >= 25 OR SALARY >= 6500;
+----+----------+-----+-----------+----------+
| ID | NAME     | AGE | ADDRESS   | SALARY   |
+----+----------+-----+-----------+----------+
|  1 | Ramesh   |  32 | Ahmedabad |  2000.00 |
|  2 | Khilan   |  25 | Delhi     |  1500.00 |
|  4 | Chaitali |  25 | mumbai    |  6500.00 |
|  5 | Hardik   |  27 | Bhopal    |  8500.00 |
|  7 | Muffy    |  24 | Indore    | 10000.00 |
+----+----------+-----+-----------+----------+
5 rows in set (0.00 sec)

mysql> ELECT * FROM CUSTOMERS WHERE AGE IS NOT NULL;
ERROR 1064 (42000): You have an error in your SQL syntax; check the manual that corresponds to your MySQL server version for the right syntax to use near 'ELECT * FROM CUSTOMERS WHERE AGE IS NOT NULL' at line 1
mysql> SELECT * FROM CUSTOMERS WHERE AGE IS NOT NULL;
+----+----------+-----+-----------+----------+
| ID | NAME     | AGE | ADDRESS   | SALARY   |
+----+----------+-----+-----------+----------+
|  1 | Ramesh   |  32 | Ahmedabad |  2000.00 |
|  2 | Khilan   |  25 | Delhi     |  1500.00 |
|  3 | kaushik  |  23 | Kota      |  2000.00 |
|  4 | Chaitali |  25 | mumbai    |  6500.00 |
|  5 | Hardik   |  27 | Bhopal    |  8500.00 |
|  6 | Komal    |  22 | Hyderabad |  4000.00 |
|  7 | Muffy    |  24 | Indore    | 10000.00 |
+----+----------+-----+-----------+----------+
7 rows in set (0.00 sec)

mysql> SELECT * FROM CUSTOMERS WHERE NAME LIKE 'Ko%';
+----+-------+-----+-----------+---------+
| ID | NAME  | AGE | ADDRESS   | SALARY  |
+----+-------+-----+-----------+---------+
|  6 | Komal |  22 | Hyderabad | 4000.00 |
+----+-------+-----+-----------+---------+
1 row in set (0.00 sec)

mysql> SELECT * FROM CUSTOMERS WHERE AGE IN ( 25, 27 );
+----+----------+-----+---------+---------+
| ID | NAME     | AGE | ADDRESS | SALARY  |
+----+----------+-----+---------+---------+
|  2 | Khilan   |  25 | Delhi   | 1500.00 |
|  4 | Chaitali |  25 | mumbai  | 6500.00 |
|  5 | Hardik   |  27 | Bhopal  | 8500.00 |
+----+----------+-----+---------+---------+
3 rows in set (0.00 sec)

mysql> SELECT * FROM CUSTOMERS WHERE AGE BETWEEN 25 AND 27;
+----+----------+-----+---------+---------+
| ID | NAME     | AGE | ADDRESS | SALARY  |
+----+----------+-----+---------+---------+
|  2 | Khilan   |  25 | Delhi   | 1500.00 |
|  4 | Chaitali |  25 | mumbai  | 6500.00 |
|  5 | Hardik   |  27 | Bhopal  | 8500.00 |
+----+----------+-----+---------+---------+
3 rows in set (0.00 sec)

mysql> SELECT AGE FROM CUSTOMERS
    -> WHERE EXISTS (SELECT AGE FROM CUSTOMERS WHERE SALARY > 6500);
+-----+
| AGE |
+-----+
|  32 |
|  25 |
|  23 |
|  25 |
|  27 |
|  22 |
|  24 |
+-----+
7 rows in set (0.00 sec)

mysql> SELECT * FROM CUSTOMERS
    -> WHERE AGE > ALL (SELECT AGE FROM CUSTOMERS WHERE SALARY > 6500);
+----+--------+-----+-----------+---------+
| ID | NAME   | AGE | ADDRESS   | SALARY  |
+----+--------+-----+-----------+---------+
|  1 | Ramesh |  32 | Ahmedabad | 2000.00 |
+----+--------+-----+-----------+---------+
1 row in set (0.01 sec)

mysql> SELECT * FROM CUSTOMERS
    -> WHERE AGE > ANY (SELECT AGE FROM CUSTOMERS WHERE SALARY > 6500);
+----+----------+-----+-----------+---------+
| ID | NAME     | AGE | ADDRESS   | SALARY  |
+----+----------+-----+-----------+---------+
|  1 | Ramesh   |  32 | Ahmedabad | 2000.00 |
|  2 | Khilan   |  25 | Delhi     | 1500.00 |
|  4 | Chaitali |  25 | mumbai    | 6500.00 |
|  5 | Hardik   |  27 | Bhopal    | 8500.00 |
+----+----------+-----+-----------+---------+
4 rows in set (0.00 sec)

mysql> SELECT * FROM CUSTOMERS WHERE SALARY = 10000;
+----+-------+-----+---------+----------+
| ID | NAME  | AGE | ADDRESS | SALARY   |
+----+-------+-----+---------+----------+
|  7 | Muffy |  24 | Indore  | 10000.00 |
+----+-------+-----+---------+----------+
1 row in set (0.00 sec)

mysql> SELECT (15 + 6) AS ADDITION
    -> ;
+----------+
| ADDITION |
+----------+
|       21 |
+----------+
1 row in set (0.00 sec)

mysql> SELECT CURRENT_TIMESTAMP;
+---------------------+
| CURRENT_TIMESTAMP   |
+---------------------+
| 2025-03-06 15:18:49 |
+---------------------+
1 row in set (0.00 sec)

mysql> SELECT GETDATE();
ERROR 1305 (42000): FUNCTION nit.GETDATE does not exist
mysql> SELECT GETDATE();;
ERROR 1305 (42000): FUNCTION nit.GETDATE does not exist
ERROR:
No query specified

mysql> SELECT GETDATE();;
ERROR 1305 (42000): FUNCTION nit.GETDATE does not exist
ERROR:
No query specified

mysql> SHOW DATABASES;
+--------------------+
| Database           |
+--------------------+
| information_schema |
| mysql              |
| nit                |
| performance_schema |
| sakila             |
| sys                |
| world              |
+--------------------+
7 rows in set (0.00 sec)

mysql> CREATE DATABASE testDB;
Query OK, 1 row affected (0.01 sec)

mysql> SHOW DATABASES;
+--------------------+
| Database           |
+--------------------+
| information_schema |
| mysql              |
| nit                |
| performance_schema |
| sakila             |
| sys                |
| testdb             |
| world              |
+--------------------+
8 rows in set (0.00 sec)

mysql> DROP DATABASE testDB;
Query OK, 0 rows affected (0.02 sec)

mysql> SHOW DATABASES;
+--------------------+
| Database           |
+--------------------+
| information_schema |
| mysql              |
| nit                |
| performance_schema |
| sakila             |
| sys                |
| world              |
+--------------------+
7 rows in set (0.00 sec)

mysql> CREATE TABLE SALARY AS
    -> SELECT ID, SALARY
    -> FROM CUSTOMERS;
Query OK, 7 rows affected (0.03 sec)
Records: 7  Duplicates: 0  Warnings: 0

mysql> CREATE DATABASE testDB;
Query OK, 1 row affected (0.01 sec)

mysql> use testDB;
Database changed
mysql> CREATE TABLE CUSTOMERS(
    -> ID INT NOT NULL,
    -> NAME VARCHAR (20) NOT NULL,
    -> AGE INT NOT NULL,
    -> ADDRESS CHAR (25) ,
    -> SALARY DECIMAL (18, 2),
    -> PRIMARY KEY (ID)
    -> );
Query OK, 0 rows affected (0.03 sec)

mysql> DESC CUSTOMERS;
+---------+---------------+------+-----+---------+-------+
| Field   | Type          | Null | Key | Default | Extra |
+---------+---------------+------+-----+---------+-------+
| ID      | int           | NO   | PRI | NULL    |       |
| NAME    | varchar(20)   | NO   |     | NULL    |       |
| AGE     | int           | NO   |     | NULL    |       |
| ADDRESS | char(25)      | YES  |     | NULL    |       |
| SALARY  | decimal(18,2) | YES  |     | NULL    |       |
+---------+---------------+------+-----+---------+-------+
5 rows in set (0.00 sec)

mysql> DROP TABLE CUSTOMERS;
Query OK, 0 rows affected (0.02 sec)

mysql> DESC CUSTOMERS;
ERROR 1146 (42S02): Table 'testdb.customers' doesn't exist
mysql> INSERT INTO CUSTOMERS (ID,NAME,AGE,ADDRESS,SALARY)
    -> VALUES (1, 'Ramesh', 32, 'Ahmedabad', 2000.00 );
ERROR 1146 (42S02): Table 'testdb.customers' doesn't exist
mysql> INSERT INTO CUSTOMERS (ID,NAME,AGE,ADDRESS,SALARY)
    -> VALUES (2, 'Khilan', 25, 'Delhi', 1500.00 );
ERROR 1146 (42S02): Table 'testdb.customers' doesn't exist
mysql> INSERT INTO CUSTOMERS (ID,NAME,AGE,ADDRESS,SALARY)
    -> VALUES (3, 'kaushik', 23, 'Kota', 2000.00 );
ERROR 1146 (42S02): Table 'testdb.customers' doesn't exist
mysql> INSERT INTO CUSTOMERS (ID,NAME,AGE,ADDRESS,SALARY)
    -> VALUES (4, 'Chaitali', 25, 'Mumbai', 6500.00 );
ERROR 1146 (42S02): Table 'testdb.customers' doesn't exist
mysql> INSERT INTO CUSTOMERS (ID,NAME,AGE,ADDRESS,SALARY)
    -> VALUES (5, 'Hardik', 27, 'Bhopal', 8500.00 );
ERROR 1146 (42S02): Table 'testdb.customers' doesn't exist
mysql> INSERT INTO CUSTOMERS (ID,NAME,AGE,ADDRESS,SALARY)
    -> VALUES (6, 'Komal', 22, 'MP', 4500.00 );
ERROR 1146 (42S02): Table 'testdb.customers' doesn't exist
mysql>
mysql> CREATE TABLE CUSTOMERS(
    -> ID INT NOT NULL,
    -> NAME VARCHAR (20) NOT NULL,
    -> AGE INT NOT NULL,
    -> ADDRESS CHAR (25) ,
    -> SALARY DECIMAL (18, 2),
    -> PRIMARY KEY (ID)
    -> );
Query OK, 0 rows affected (0.03 sec)

mysql> INSERT INTO CUSTOMERS (ID,NAME,AGE,ADDRESS,SALARY)
    -> VALUES (1, 'Ramesh', 32, 'Ahmedabad', 2000.00 );
Query OK, 1 row affected (0.01 sec)

mysql> INSERT INTO CUSTOMERS (ID,NAME,AGE,ADDRESS,SALARY)
    -> VALUES (2, 'Khilan', 25, 'Delhi', 1500.00 );
Query OK, 1 row affected (0.00 sec)

mysql> INSERT INTO CUSTOMERS (ID,NAME,AGE,ADDRESS,SALARY)
    -> VALUES (3, 'kaushik', 23, 'Kota', 2000.00 );
Query OK, 1 row affected (0.00 sec)

mysql> INSERT INTO CUSTOMERS (ID,NAME,AGE,ADDRESS,SALARY)
    -> VALUES (4, 'Chaitali', 25, 'Mumbai', 6500.00 );
Query OK, 1 row affected (0.00 sec)

mysql> INSERT INTO CUSTOMERS (ID,NAME,AGE,ADDRESS,SALARY)
    -> VALUES (5, 'Hardik', 27, 'Bhopal', 8500.00 );
Query OK, 1 row affected (0.00 sec)

mysql> INSERT INTO CUSTOMERS (ID,NAME,AGE,ADDRESS,SALARY)
    -> VALUES (6, 'Komal', 22, 'MP', 4500.00 );
Query OK, 1 row affected (0.01 sec)

mysql> INSERT INTO CUSTOMERS
    -> VALUES (7, 'Muffy', 24, 'Indore', 10000.00 );
Query OK, 1 row affected (0.01 sec)

mysql> select * from customers;
+----+----------+-----+-----------+----------+
| ID | NAME     | AGE | ADDRESS   | SALARY   |
+----+----------+-----+-----------+----------+
|  1 | Ramesh   |  32 | Ahmedabad |  2000.00 |
|  2 | Khilan   |  25 | Delhi     |  1500.00 |
|  3 | kaushik  |  23 | Kota      |  2000.00 |
|  4 | Chaitali |  25 | Mumbai    |  6500.00 |
|  5 | Hardik   |  27 | Bhopal    |  8500.00 |
|  6 | Komal    |  22 | MP        |  4500.00 |
|  7 | Muffy    |  24 | Indore    | 10000.00 |
+----+----------+-----+-----------+----------+
7 rows in set (0.00 sec)

mysql> SELECT ID, NAME, SALARY FROM CUSTOMERS;
+----+----------+----------+
| ID | NAME     | SALARY   |
+----+----------+----------+
|  1 | Ramesh   |  2000.00 |
|  2 | Khilan   |  1500.00 |
|  3 | kaushik  |  2000.00 |
|  4 | Chaitali |  6500.00 |
|  5 | Hardik   |  8500.00 |
|  6 | Komal    |  4500.00 |
|  7 | Muffy    | 10000.00 |
+----+----------+----------+
7 rows in set (0.00 sec)

mysql> SELECT ID, NAME, SALARY
    -> FROM CUSTOMERS
    -> WHERE SALARY > 2000;
+----+----------+----------+
| ID | NAME     | SALARY   |
+----+----------+----------+
|  4 | Chaitali |  6500.00 |
|  5 | Hardik   |  8500.00 |
|  6 | Komal    |  4500.00 |
|  7 | Muffy    | 10000.00 |
+----+----------+----------+
4 rows in set (0.00 sec)

mysql> SELECT ID, NAME, SALARY
    -> FROM CUSTOMERS
    -> WHERE NAME = 'Hardik';
+----+--------+---------+
| ID | NAME   | SALARY  |
+----+--------+---------+
|  5 | Hardik | 8500.00 |
+----+--------+---------+
1 row in set (0.00 sec)

mysql> SELECT ID, NAME, SALARY
    -> FROM CUSTOMERS
    -> WHERE SALARY > 2000 AND age < 25;
+----+-------+----------+
| ID | NAME  | SALARY   |
+----+-------+----------+
|  6 | Komal |  4500.00 |
|  7 | Muffy | 10000.00 |
+----+-------+----------+
2 rows in set (0.00 sec)

mysql> SELECT ID, NAME, SALARY
    -> FROM CUSTOMERS
    -> WHERE SALARY > 2000 OR age < 25;
+----+----------+----------+
| ID | NAME     | SALARY   |
+----+----------+----------+
|  3 | kaushik  |  2000.00 |
|  4 | Chaitali |  6500.00 |
|  5 | Hardik   |  8500.00 |
|  6 | Komal    |  4500.00 |
|  7 | Muffy    | 10000.00 |
+----+----------+----------+
5 rows in set (0.00 sec)

mysql> UPDATE CUSTOMERS
    -> SET ADDRESS = 'Pune'
    -> WHERE ID = 6;
Query OK, 1 row affected (0.01 sec)
Rows matched: 1  Changed: 1  Warnings: 0

mysql> UPDATE CUSTOMERS
    -> SET ADDRESS = 'Pune', SALARY = 1000.00;
Query OK, 7 rows affected (0.01 sec)
Rows matched: 7  Changed: 7  Warnings: 0

mysql> select * from customers;
+----+----------+-----+---------+---------+
| ID | NAME     | AGE | ADDRESS | SALARY  |
+----+----------+-----+---------+---------+
|  1 | Ramesh   |  32 | Pune    | 1000.00 |
|  2 | Khilan   |  25 | Pune    | 1000.00 |
|  3 | kaushik  |  23 | Pune    | 1000.00 |
|  4 | Chaitali |  25 | Pune    | 1000.00 |
|  5 | Hardik   |  27 | Pune    | 1000.00 |
|  6 | Komal    |  22 | Pune    | 1000.00 |
|  7 | Muffy    |  24 | Pune    | 1000.00 |
+----+----------+-----+---------+---------+
7 rows in set (0.00 sec)

mysql> DELETE FROM CUSTOMERS
    -> WHERE ID = 6;
Query OK, 1 row affected (0.01 sec)

mysql> DELETE FROM CUSTOMERS;
Query OK, 6 rows affected (0.01 sec)

mysql> select * from customers;
Empty set (0.00 sec)

mysql> INSERT INTO CUSTOMERS (ID,NAME,AGE,ADDRESS,SALARY)
    -> VALUES (1, 'Ramesh', 32, 'Ahmedabad', 2000.00 );
Query OK, 1 row affected (0.01 sec)

mysql> INSERT INTO CUSTOMERS (ID,NAME,AGE,ADDRESS,SALARY)
    -> VALUES (2, 'Khilan', 25, 'Delhi', 1500.00 );
Query OK, 1 row affected (0.00 sec)

mysql> INSERT INTO CUSTOMERS (ID,NAME,AGE,ADDRESS,SALARY)
    -> VALUES (3, 'kaushik', 23, 'Kota', 2000.00 );
Query OK, 1 row affected (0.00 sec)

mysql> INSERT INTO CUSTOMERS (ID,NAME,AGE,ADDRESS,SALARY)
    -> VALUES (4, 'Chaitali', 25, 'Mumbai', 6500.00 );
Query OK, 1 row affected (0.00 sec)

mysql> INSERT INTO CUSTOMERS (ID,NAME,AGE,ADDRESS,SALARY)
    -> VALUES (5, 'Hardik', 27, 'Bhopal', 8500.00 );
Query OK, 1 row affected (0.00 sec)

mysql> INSERT INTO CUSTOMERS (ID,NAME,AGE,ADDRESS,SALARY)
    -> VALUES (6, 'Komal', 22, 'MP', 4500.00 );
Query OK, 1 row affected (0.01 sec)

mysql> INSERT INTO CUSTOMERS
    -> VALUES (7, 'Muffy', 24, 'Indore', 10000.00 );
Query OK, 1 row affected (0.01 sec)

mysql> select * from customers;
+----+----------+-----+-----------+----------+
| ID | NAME     | AGE | ADDRESS   | SALARY   |
+----+----------+-----+-----------+----------+
|  1 | Ramesh   |  32 | Ahmedabad |  2000.00 |
|  2 | Khilan   |  25 | Delhi     |  1500.00 |
|  3 | kaushik  |  23 | Kota      |  2000.00 |
|  4 | Chaitali |  25 | Mumbai    |  6500.00 |
|  5 | Hardik   |  27 | Bhopal    |  8500.00 |
|  6 | Komal    |  22 | MP        |  4500.00 |
|  7 | Muffy    |  24 | Indore    | 10000.00 |
+----+----------+-----+-----------+----------+
7 rows in set (0.00 sec)

mysql> SELECT * FROM CUSTOMERS
    -> WHERE SALARY LIKE '200%';
+----+---------+-----+-----------+---------+
| ID | NAME    | AGE | ADDRESS   | SALARY  |
+----+---------+-----+-----------+---------+
|  1 | Ramesh  |  32 | Ahmedabad | 2000.00 |
|  3 | kaushik |  23 | Kota      | 2000.00 |
+----+---------+-----+-----------+---------+
2 rows in set (0.00 sec)

mysql> SELECT TOP 3 * FROM CUSTOMERS;
ERROR 1064 (42000): You have an error in your SQL syntax; check the manual that corresponds to your MySQL server version for the right syntax to use near '3 * FROM CUSTOMERS' at line 1
mysql> SELECT *
    -> FROM CUSTOMERS
    -> LIMIT 3;
+----+---------+-----+-----------+---------+
| ID | NAME    | AGE | ADDRESS   | SALARY  |
+----+---------+-----+-----------+---------+
|  1 | Ramesh  |  32 | Ahmedabad | 2000.00 |
|  2 | Khilan  |  25 | Delhi     | 1500.00 |
|  3 | kaushik |  23 | Kota      | 2000.00 |
+----+---------+-----+-----------+---------+
3 rows in set (0.00 sec)

mysql> SELECT * FROM CUSTOMERS
    -> WHERE ROWNUM <= 3;
ERROR 1054 (42S22): Unknown column 'ROWNUM' in 'where clause'
mysql> SELECT * FROM CUSTOMERS
    -> ORDER BY NAME, SALARY;
+----+----------+-----+-----------+----------+
| ID | NAME     | AGE | ADDRESS   | SALARY   |
+----+----------+-----+-----------+----------+
|  4 | Chaitali |  25 | Mumbai    |  6500.00 |
|  5 | Hardik   |  27 | Bhopal    |  8500.00 |
|  3 | kaushik  |  23 | Kota      |  2000.00 |
|  2 | Khilan   |  25 | Delhi     |  1500.00 |
|  6 | Komal    |  22 | MP        |  4500.00 |
|  7 | Muffy    |  24 | Indore    | 10000.00 |
|  1 | Ramesh   |  32 | Ahmedabad |  2000.00 |
+----+----------+-----+-----------+----------+
7 rows in set (0.00 sec)

mysql> SELECT * FROM CUSTOMERS
    -> ORDER BY NAME DESC;
+----+----------+-----+-----------+----------+
| ID | NAME     | AGE | ADDRESS   | SALARY   |
+----+----------+-----+-----------+----------+
|  1 | Ramesh   |  32 | Ahmedabad |  2000.00 |
|  7 | Muffy    |  24 | Indore    | 10000.00 |
|  6 | Komal    |  22 | MP        |  4500.00 |
|  2 | Khilan   |  25 | Delhi     |  1500.00 |
|  3 | kaushik  |  23 | Kota      |  2000.00 |
|  5 | Hardik   |  27 | Bhopal    |  8500.00 |
|  4 | Chaitali |  25 | Mumbai    |  6500.00 |
+----+----------+-----+-----------+----------+
7 rows in set (0.00 sec)

mysql> SELECT NAME, SUM(SALARY) FROM CUSTOMERS
    -> GROUP BY NAME;
+----------+-------------+
| NAME     | SUM(SALARY) |
+----------+-------------+
| Ramesh   |     2000.00 |
| Khilan   |     1500.00 |
| kaushik  |     2000.00 |
| Chaitali |     6500.00 |
| Hardik   |     8500.00 |
| Komal    |     4500.00 |
| Muffy    |    10000.00 |
+----------+-------------+
7 rows in set (0.01 sec)

mysql> SELECT NAME, SUM(SALARY) FROM CUSTOMERS
    -> GROUP BY NAME;
+----------+-------------+
| NAME     | SUM(SALARY) |
+----------+-------------+
| Ramesh   |     2000.00 |
| Khilan   |     1500.00 |
| kaushik  |     2000.00 |
| Chaitali |     6500.00 |
| Hardik   |     8500.00 |
| Komal    |     4500.00 |
| Muffy    |    10000.00 |
+----------+-------------+
7 rows in set (0.00 sec)

mysql> SELECT SALARY FROM CUSTOMERS
    -> ORDER BY SALARY;
+----------+
| SALARY   |
+----------+
|  1500.00 |
|  2000.00 |
|  2000.00 |
|  4500.00 |
|  6500.00 |
|  8500.00 |
| 10000.00 |
+----------+
7 rows in set (0.00 sec)

mysql>
